{
  "version": "1",
  "name": "PestInspection",
  "tableName": "pest_inspections",
  "fields": [
    {
      "name": "inspectedAt",
      "type": "LocalDateTime",
      "nullable": false
    },
    {
      "name": "pestType",
      "type": "String",
      "length": 120,
      "nullable": false
    },
    {
      "name": "severity",
      "type": "Enum",
      "enumValues": ["LOW", "MEDIUM", "HIGH", "CRITICAL"],
      "nullable": false
    },
    {
      "name": "affectedAreaSquareMeters",
      "type": "BigDecimal",
      "precision": 10,
      "scale": 2,
      "nullable": true
    },
    {
      "name": "treatmentApplied",
      "type": "Boolean",
      "nullable": false,
      "defaultValue": false
    }
  ],
  "relations": [
    {
      "name": "cropCycle",
      "type": "ManyToOne",
      "target": "CropCycle",
      "joinColumn": "crop_cycle_id",
      "fetch": "LAZY"
    }
  ],
  "options": {
    "generateController": true,
    "generateFrontend": true,
    "auditable": false
  }
}
