{
  "version": "1",
  "name": "Measurement",
  "tableName": "measurements",
  "fields": [
    {
      "name": "recordedAt",
      "type": "LocalDateTime",
      "nullable": false
    },
    {
      "name": "temperature",
      "type": "BigDecimal",
      "precision": 8,
      "scale": 2,
      "nullable": false
    }
  ],
  "relations": [
    {
      "name": "sensor",
      "type": "ManyToOne",
      "target": "Sensor",
      "joinColumn": "sensor_id",
      "fetch": "LAZY"
    }
  ]
}
